{
  "approval_status": "draft",
  "artifact_root": "",
  "change_set": [
    {
      "from": 0.25,
      "knob": "slippage_bps",
      "to": 0.2
    }
  ],
  "config_diff": {
    "slippage_bps": 0.2
  },
  "decision_seed": 1729,
  "evaluation_plan": {
    "dataset": "provided",
    "guardrails": {
      "max_drawdown_pct": 12.0,
      "min_trades": 30
    },
    "iterations": 12,
    "objective": "sharpe_like",
    "rows": 13477,
    "walk_forward": {
      "enabled": true,
      "oos_fraction": 0.3,
      "oos_tolerance": 0.25
    }
  },
  "evidence_refs": [
    "D:\\Development\\Trading Agent\\artifacts\\self_correction\\runs\\20260609_144838\\improve\\best_config.json",
    "D:\\Development\\Trading Agent\\artifacts\\self_correction\\runs\\20260609_144838\\improve\\summary.json",
    "D:\\Development\\Trading Agent\\artifacts\\self_correction\\runs\\20260609_144838\\improve\\reflection_memory.jsonl"
  ],
  "experiment_id": "4f581bbb-ed9e-54a2-9055-d2c241aa43e2",
  "hypothesis": "lower slippage_bps from 0.25 to 0.2 to improve sharpe",
  "input_artefact_refs": [],
  "latest_promotion_id": "",
  "latest_stage": "proposed",
  "model_id": "",
  "prompt_hash": "",
  "replay_window": "",
  "risk_notes": [
    "All knob edits passed the deterministic change-set allowlist (validate_change_set).",
    "Risk-locked caps may only tighten vs the incumbent; loosening is blocked at apply time.",
    "Promotion guardrails: min_trades and max_drawdown_pct enforced by objective.score_metrics."
  ],
  "source_run_id": null,
  "tool_trace_hash": ""
}